OpenROAD b16bda7e82721d10566ff7e2b68f1ff0be9f9e38 
Features included (+) or not (-): +Charts +GPU +GUI +Python
This program is licensed under the BSD-3 license. See the LICENSE file for details.
Components of this program may be licensed under more restrictive licenses which must be honored.
define_corners Typical
read_liberty -corner Typical /volare/sky130A/libs.ref/sky130_fd_sc_hd/lib/sky130_fd_sc_hd__tt_025C_1v80.lib
Using 1e-12 for capacitance...
Using 1e+03 for resistance...
Using 1e-09 for time...
Using 1e+00 for voltage...
Using 1e-03 for current...
Using 1e-09 for power...
Using 1e-06 for distance...
[INFO]: Reading ODB at '/openlane/designs/ksa/runs/auto_pnr/tmp/17-ksa.odb'…
Reading design constraints file at '/openlane/designs/ksa/src/ksa.sdc'…
[INFO]: Setting signal min routing layer to: met1 and clock min routing layer to met3. 
[INFO]: Setting signal max routing layer to: met5 and clock max routing layer to met5. 
-congestion_iterations 50 -verbose -congestion_report_file /openlane/designs/ksa/runs/auto_pnr/tmp/routing/groute-congestion.rpt
[INFO GRT-0020] Min routing layer: met1
[INFO GRT-0021] Max routing layer: met5
[INFO GRT-0022] Global adjustment: 30%
[INFO GRT-0023] Grid origin: (0, 0)
[INFO GRT-0043] No OR_DEFAULT vias defined.
[INFO GRT-0088] Layer li1     Track-Pitch = 0.4600  line-2-Via Pitch: 0.3400
[INFO GRT-0088] Layer met1    Track-Pitch = 0.3400  line-2-Via Pitch: 0.3400
[INFO GRT-0088] Layer met2    Track-Pitch = 0.4600  line-2-Via Pitch: 0.3500
[INFO GRT-0088] Layer met3    Track-Pitch = 0.6800  line-2-Via Pitch: 0.6150
[INFO GRT-0088] Layer met4    Track-Pitch = 0.9200  line-2-Via Pitch: 1.0400
[INFO GRT-0088] Layer met5    Track-Pitch = 3.4000  line-2-Via Pitch: 3.1100
[INFO GRT-0019] Found 6 clock nets.
[INFO GRT-0001] Minimum degree: 2
[INFO GRT-0002] Maximum degree: 16
[INFO GRT-0003] Macros: 0
[INFO GRT-0043] No OR_DEFAULT vias defined.
[INFO GRT-0004] Blockages: 740

[INFO GRT-0053] Routing resources analysis:
          Routing      Original      Derated      Resource
Layer     Direction    Resources     Resources    Reduction (%)
---------------------------------------------------------------
li1        Vertical            0             0          0.00%
met1       Horizontal       3244          1568          51.66%
met2       Vertical         2355          1424          39.53%
met3       Horizontal       1622          1001          38.29%
met4       Vertical          955           426          55.39%
met5       Horizontal        322           121          62.42%
---------------------------------------------------------------

[INFO GRT-0197] Via related to pin nodes: 1387
[INFO GRT-0198] Via related Steiner nodes: 8
[INFO GRT-0199] Via filling finished.
[INFO GRT-0111] Final number of vias: 1696
[INFO GRT-0112] Final usage 3D: 5794

[INFO GRT-0096] Final congestion report:
Layer         Resource        Demand        Usage (%)    Max H / Max V / Total Overflow
---------------------------------------------------------------------------------------
li1                  0             0            0.00%             0 /  0 /  0
met1              1568           306           19.52%             0 /  0 /  0
met2              1424           385           27.04%             0 /  0 /  0
met3              1001             7            0.70%             0 /  0 /  0
met4               426             8            1.88%             0 /  0 /  0
met5               121             0            0.00%             0 /  0 /  0
---------------------------------------------------------------------------------------
Total             4540           706           15.55%             0 /  0 /  0

[INFO GRT-0018] Total wirelength: 8625 um
[INFO GRT-0014] Routed nets: 284
[INFO GRT-0006] Repairing antennas, iteration 1.
[INFO GRT-0043] No OR_DEFAULT vias defined.
[INFO GRT-0012] Found 0 antenna violations.
Placement Analysis
---------------------------------
total displacement          0.0 u
average displacement        0.0 u
max displacement            0.0 u
original HPWL            4939.8 u
legalized HPWL           5314.6 u
delta HPWL                    8 %

[INFO DPL-0020] Mirrored 136 instances
[INFO DPL-0021] HPWL before            5314.6 u
[INFO DPL-0022] HPWL after             4939.8 u
[INFO DPL-0023] HPWL delta               -7.1 %
[INFO]: Setting signal min routing layer to: met1 and clock min routing layer to met3. 
[INFO]: Setting signal max routing layer to: met5 and clock max routing layer to met5. 
-congestion_iterations 50 -verbose -congestion_report_file /openlane/designs/ksa/runs/auto_pnr/tmp/routing/groute-congestion.rpt
[INFO GRT-0020] Min routing layer: met1
[INFO GRT-0021] Max routing layer: met5
[INFO GRT-0022] Global adjustment: 30%
[INFO GRT-0023] Grid origin: (0, 0)
[INFO GRT-0043] No OR_DEFAULT vias defined.
[INFO GRT-0088] Layer li1     Track-Pitch = 0.4600  line-2-Via Pitch: 0.3400
[INFO GRT-0088] Layer met1    Track-Pitch = 0.3400  line-2-Via Pitch: 0.3400
[INFO GRT-0088] Layer met2    Track-Pitch = 0.4600  line-2-Via Pitch: 0.3500
[INFO GRT-0088] Layer met3    Track-Pitch = 0.6800  line-2-Via Pitch: 0.6150
[INFO GRT-0088] Layer met4    Track-Pitch = 0.9200  line-2-Via Pitch: 1.0400
[INFO GRT-0088] Layer met5    Track-Pitch = 3.4000  line-2-Via Pitch: 3.1100
[INFO GRT-0019] Found 6 clock nets.
[INFO GRT-0001] Minimum degree: 2
[INFO GRT-0002] Maximum degree: 16
[INFO GRT-0003] Macros: 0
[INFO GRT-0043] No OR_DEFAULT vias defined.
[INFO GRT-0004] Blockages: 740

[INFO GRT-0053] Routing resources analysis:
          Routing      Original      Derated      Resource
Layer     Direction    Resources     Resources    Reduction (%)
---------------------------------------------------------------
li1        Vertical            0             0          0.00%
met1       Horizontal       3244          1568          51.66%
met2       Vertical         2355          1424          39.53%
met3       Horizontal       1622          1001          38.29%
met4       Vertical          955           426          55.39%
met5       Horizontal        322           121          62.42%
---------------------------------------------------------------

[INFO GRT-0197] Via related to pin nodes: 1387
[INFO GRT-0198] Via related Steiner nodes: 8
[INFO GRT-0199] Via filling finished.
[INFO GRT-0111] Final number of vias: 1696
[INFO GRT-0112] Final usage 3D: 5794

[INFO GRT-0096] Final congestion report:
Layer         Resource        Demand        Usage (%)    Max H / Max V / Total Overflow
---------------------------------------------------------------------------------------
li1                  0             0            0.00%             0 /  0 /  0
met1              1568           306           19.52%             0 /  0 /  0
met2              1424           385           27.04%             0 /  0 /  0
met3              1001             7            0.70%             0 /  0 /  0
met4               426             8            1.88%             0 /  0 /  0
met5               121             0            0.00%             0 /  0 /  0
---------------------------------------------------------------------------------------
Total             4540           706           15.55%             0 /  0 /  0

[INFO GRT-0018] Total wirelength: 8625 um
[INFO GRT-0014] Routed nets: 284
Setting global connections for newly added cells…
Writing OpenROAD database to '/openlane/designs/ksa/runs/auto_pnr/tmp/routing/19-global.odb'…
Writing layout to '/openlane/designs/ksa/runs/auto_pnr/tmp/routing/19-global.def'…
Writing routing guides to '/openlane/designs/ksa/runs/auto_pnr/tmp/routing/19-global.guide'…
