
 /----------------------------------------------------------------------------\
 |                                                                            |
 |  yosys -- Yosys Open SYnthesis Suite                                       |
 |                                                                            |
 |  Copyright (C) 2012 - 2020  Claire Xenia Wolf <claire@yosyshq.com>         |
 |                                                                            |
 |  Permission to use, copy, modify, and/or distribute this software for any  |
 |  purpose with or without fee is hereby granted, provided that the above    |
 |  copyright notice and this permission notice appear in all copies.         |
 |                                                                            |
 |  THE SOFTWARE IS PROVIDED "AS IS" AND THE AUTHOR DISCLAIMS ALL WARRANTIES  |
 |  WITH REGARD TO THIS SOFTWARE INCLUDING ALL IMPLIED WARRANTIES OF          |
 |  MERCHANTABILITY AND FITNESS. IN NO EVENT SHALL THE AUTHOR BE LIABLE FOR   |
 |  ANY SPECIAL, DIRECT, INDIRECT, OR CONSEQUENTIAL DAMAGES OR ANY DAMAGES    |
 |  WHATSOEVER RESULTING FROM LOSS OF USE, DATA OR PROFITS, WHETHER IN AN     |
 |  ACTION OF CONTRACT, NEGLIGENCE OR OTHER TORTIOUS ACTION, ARISING OUT OF   |
 |  OR IN CONNECTION WITH THE USE OR PERFORMANCE OF THIS SOFTWARE.            |
 |                                                                            |
 \----------------------------------------------------------------------------/

 Yosys 0.38 (git sha1 543faed9c8c, clang++ 17.0.6 -fPIC -Os)

[TCL: yosys -import] Command name collision: found pre-existing command `cd' -> skip.
[TCL: yosys -import] Command name collision: found pre-existing command `eval' -> skip.
[TCL: yosys -import] Command name collision: found pre-existing command `exec' -> skip.
[TCL: yosys -import] Command name collision: found pre-existing command `read' -> skip.
[TCL: yosys -import] Command name collision: found pre-existing command `trace' -> skip.

1. Executing Liberty frontend: /volare/sky130A/libs.ref/sky130_fd_sc_hd/lib/sky130_fd_sc_hd__tt_025C_1v80.lib
Imported 428 cell types from liberty file.

2. Executing Verilog-2005 frontend: /openlane/designs/bka/src/bka.v
Parsing SystemVerilog input from `/openlane/designs/bka/src/bka.v' to AST representation.
Storing AST representation for module `$abstract\bka'.
Storing AST representation for module `$abstract\prep'.
Storing AST representation for module `$abstract\pro'.
Storing AST representation for module `$abstract\post'.
Successfully finished Verilog frontend.

3. Executing HIERARCHY pass (managing design hierarchy).

4. Executing AST frontend in derive mode using pre-parsed AST for module `\bka'.
Generating RTLIL representation for module `\bka'.

4.1. Analyzing design hierarchy..
Top module:  \bka

4.2. Executing AST frontend in derive mode using pre-parsed AST for module `\post'.
Generating RTLIL representation for module `\post'.

4.3. Executing AST frontend in derive mode using pre-parsed AST for module `\pro'.
Generating RTLIL representation for module `\pro'.

4.4. Executing AST frontend in derive mode using pre-parsed AST for module `\prep'.
Generating RTLIL representation for module `\prep'.

4.5. Analyzing design hierarchy..
Top module:  \bka
Used module:     \post
Used module:     \pro
Used module:     \prep

4.6. Analyzing design hierarchy..
Top module:  \bka
Used module:     \post
Used module:     \pro
Used module:     \prep
Removing unused module `$abstract\post'.
Removing unused module `$abstract\pro'.
Removing unused module `$abstract\prep'.
Removing unused module `$abstract\bka'.
Removed 4 unused modules.

5. Generating Graphviz representation of design.
Writing dot description to `/openlane/designs/bka/runs/auto_pnr/tmp/synthesis/hierarchy.dot'.
Dumping module bka to page 1.
Renaming module bka to bka.

6. Executing TRIBUF pass.

7. Executing HIERARCHY pass (managing design hierarchy).

7.1. Analyzing design hierarchy..
Top module:  \bka
Used module:     \post
Used module:     \pro
Used module:     \prep

7.2. Analyzing design hierarchy..
Top module:  \bka
Used module:     \post
Used module:     \pro
Used module:     \prep
Removed 0 unused modules.

8. Executing PROC_CLEAN pass (remove empty switches from decision trees).
Cleaned up 0 empty switches.

9. Executing PROC_RMDEAD pass (remove dead branches from decision trees).
Removed a total of 0 dead cases.

10. Executing PROC_PRUNE pass (remove redundant assignments in processes).
Removed 0 redundant assignments.
Promoted 5 assignments to connections.

11. Executing PROC_INIT pass (extract init attributes).

12. Executing PROC_ARST pass (detect async resets in processes).

13. Executing PROC_ROM pass (convert switches to ROMs).
Converted 0 switches.

14. Executing PROC_MUX pass (convert decision trees to multiplexers).
Creating decoders for process `\bka.$proc$/openlane/designs/bka/src/bka.v:973$1'.

15. Executing PROC_DLATCH pass (convert process syncs to latches).

16. Executing PROC_DFF pass (convert process syncs to FFs).
Creating register for signal `\bka.\S' using process `\bka.$proc$/openlane/designs/bka/src/bka.v:973$1'.
  created $dff cell `$procdff$8' with positive edge clock.
Creating register for signal `\bka.\Cout' using process `\bka.$proc$/openlane/designs/bka/src/bka.v:973$1'.
  created $dff cell `$procdff$9' with positive edge clock.
Creating register for signal `\bka.\Aq' using process `\bka.$proc$/openlane/designs/bka/src/bka.v:973$1'.
  created $dff cell `$procdff$10' with positive edge clock.
Creating register for signal `\bka.\Bq' using process `\bka.$proc$/openlane/designs/bka/src/bka.v:973$1'.
  created $dff cell `$procdff$11' with positive edge clock.
Creating register for signal `\bka.\Cinq' using process `\bka.$proc$/openlane/designs/bka/src/bka.v:973$1'.
  created $dff cell `$procdff$12' with positive edge clock.

17. Executing PROC_MEMWR pass (convert process memory writes to cells).

18. Executing PROC_CLEAN pass (remove empty switches from decision trees).
Removing empty process `bka.$proc$/openlane/designs/bka/src/bka.v:973$1'.
Cleaned up 0 empty switches.

19. Executing CHECK pass (checking for obvious problems).
Checking module bka...
Checking module pro...
Checking module post...
Checking module prep...
Found and reported 0 problems.

20. Executing OPT_EXPR pass (perform const folding).
Optimizing module bka.
Optimizing module pro.
Optimizing module post.
Optimizing module prep.

21. Executing FLATTEN pass (flatten design).
Deleting now unused module pro.
Deleting now unused module post.
Deleting now unused module prep.
<suppressed ~74 debug messages>

22. Executing OPT_EXPR pass (perform const folding).
Optimizing module bka.
<suppressed ~16 debug messages>

23. Executing OPT_CLEAN pass (remove unused cells and wires).
Finding unused cells or wires in module \bka..
Removed 0 unused cells and 137 unused wires.
<suppressed ~1 debug messages>

24. Executing OPT pass (performing simple optimizations).

24.1. Executing OPT_EXPR pass (perform const folding).
Optimizing module bka.

24.2. Executing OPT_MERGE pass (detect identical cells).
Finding identical cells in module `\bka'.
Removed a total of 0 cells.

24.3. Executing OPT_MUXTREE pass (detect dead branches in mux trees).
Running muxtree optimizer on module \bka..
  Creating internal representation of mux trees.
  No muxes found in this module.
Removed 0 multiplexer ports.

24.4. Executing OPT_REDUCE pass (consolidate $*mux and $reduce_* inputs).
  Optimizing cells in module \bka.
Performed a total of 0 changes.

24.5. Executing OPT_MERGE pass (detect identical cells).
Finding identical cells in module `\bka'.
Removed a total of 0 cells.

24.6. Executing OPT_DFF pass (perform DFF optimizations).

24.7. Executing OPT_CLEAN pass (remove unused cells and wires).
Finding unused cells or wires in module \bka..

24.8. Executing OPT_EXPR pass (perform const folding).
Optimizing module bka.

24.9. Finished OPT passes. (There is nothing left to do.)

25. Executing FSM pass (extract and optimize FSM).

25.1. Executing FSM_DETECT pass (finding FSMs in design).

25.2. Executing FSM_EXTRACT pass (extracting FSM from design).

25.3. Executing FSM_OPT pass (simple optimizations of FSMs).

25.4. Executing OPT_CLEAN pass (remove unused cells and wires).
Finding unused cells or wires in module \bka..

25.5. Executing FSM_OPT pass (simple optimizations of FSMs).

25.6. Executing FSM_RECODE pass (re-assigning FSM state encoding).

25.7. Executing FSM_INFO pass (dumping all available information on FSM cells).

25.8. Executing FSM_MAP pass (mapping FSMs to basic logic).

26. Executing OPT pass (performing simple optimizations).

26.1. Executing OPT_EXPR pass (perform const folding).
Optimizing module bka.

26.2. Executing OPT_MERGE pass (detect identical cells).
Finding identical cells in module `\bka'.
Removed a total of 0 cells.

26.3. Executing OPT_MUXTREE pass (detect dead branches in mux trees).
Running muxtree optimizer on module \bka..
  Creating internal representation of mux trees.
  No muxes found in this module.
Removed 0 multiplexer ports.

26.4. Executing OPT_REDUCE pass (consolidate $*mux and $reduce_* inputs).
  Optimizing cells in module \bka.
Performed a total of 0 changes.

26.5. Executing OPT_MERGE pass (detect identical cells).
Finding identical cells in module `\bka'.
Removed a total of 0 cells.

26.6. Executing OPT_DFF pass (perform DFF optimizations).

26.7. Executing OPT_CLEAN pass (remove unused cells and wires).
Finding unused cells or wires in module \bka..

26.8. Executing OPT_EXPR pass (perform const folding).
Optimizing module bka.

26.9. Finished OPT passes. (There is nothing left to do.)

27. Executing WREDUCE pass (reducing word size of cells).

28. Executing PEEPOPT pass (run peephole optimizers).

29. Executing OPT_CLEAN pass (remove unused cells and wires).
Finding unused cells or wires in module \bka..

30. Executing ALUMACC pass (create $alu and $macc cells).
Extracting $alu and $macc cells in module bka:
  creating $macc model for $flatten\x13.$add$/openlane/designs/bka/src/bka.v:1018$5 ($add).
  creating $macc model for $flatten\x14.$add$/openlane/designs/bka/src/bka.v:1018$5 ($add).
  creating $macc model for $flatten\x16.$add$/openlane/designs/bka/src/bka.v:1018$5 ($add).
  creating $macc model for $flatten\x17.$add$/openlane/designs/bka/src/bka.v:1018$5 ($add).
  creating $macc model for $flatten\x18.$add$/openlane/designs/bka/src/bka.v:1018$5 ($add).
  creating $macc model for $flatten\x19.$add$/openlane/designs/bka/src/bka.v:1018$5 ($add).
  creating $macc model for $flatten\x20.$add$/openlane/designs/bka/src/bka.v:1018$5 ($add).
  creating $macc model for $flatten\x21.$add$/openlane/designs/bka/src/bka.v:1018$5 ($add).
  creating $macc model for $flatten\x22.$add$/openlane/designs/bka/src/bka.v:1018$5 ($add).
  creating $macc model for $flatten\x23.$add$/openlane/designs/bka/src/bka.v:1018$5 ($add).
  creating $macc model for $flatten\x24.$add$/openlane/designs/bka/src/bka.v:1018$5 ($add).
  creating $macc model for $flatten\x25.$add$/openlane/designs/bka/src/bka.v:1018$5 ($add).
  creating $macc model for $flatten\x26.$add$/openlane/designs/bka/src/bka.v:1018$5 ($add).
  creating $macc model for $flatten\x28.$add$/openlane/designs/bka/src/bka.v:1018$5 ($add).
  creating $macc model for $flatten\x32.$add$/openlane/designs/bka/src/bka.v:1018$5 ($add).
  creating $macc model for $flatten\x37.$add$/openlane/designs/bka/src/bka.v:1018$5 ($add).
  creating $macc model for $flatten\x38.$add$/openlane/designs/bka/src/bka.v:1018$5 ($add).
  creating $macc model for $flatten\x40.$add$/openlane/designs/bka/src/bka.v:1018$5 ($add).
  creating $macc model for $flatten\x41.$add$/openlane/designs/bka/src/bka.v:1018$5 ($add).
  creating $macc model for $flatten\x42.$add$/openlane/designs/bka/src/bka.v:1018$5 ($add).
  creating $macc model for $flatten\x43.$add$/openlane/designs/bka/src/bka.v:1018$5 ($add).
  creating $macc model for $flatten\x44.$add$/openlane/designs/bka/src/bka.v:1018$5 ($add).
  creating $macc model for $flatten\x45.$add$/openlane/designs/bka/src/bka.v:1018$5 ($add).
  creating $macc model for $flatten\x46.$add$/openlane/designs/bka/src/bka.v:1018$5 ($add).
  creating $macc model for $flatten\x47.$add$/openlane/designs/bka/src/bka.v:1018$5 ($add).
  creating $macc model for $flatten\x48.$add$/openlane/designs/bka/src/bka.v:1018$5 ($add).
  creating $macc model for $flatten\x49.$add$/openlane/designs/bka/src/bka.v:1018$5 ($add).
  creating $macc model for $flatten\x50.$add$/openlane/designs/bka/src/bka.v:1018$5 ($add).
  creating $macc model for $flatten\x51.$add$/openlane/designs/bka/src/bka.v:1018$5 ($add).
  creating $macc model for $flatten\x52.$add$/openlane/designs/bka/src/bka.v:1018$5 ($add).
  creating $macc model for $flatten\x53.$add$/openlane/designs/bka/src/bka.v:1018$5 ($add).
  creating $macc model for $flatten\x54.$add$/openlane/designs/bka/src/bka.v:1018$5 ($add).
  creating $macc model for $flatten\x55.$add$/openlane/designs/bka/src/bka.v:1018$5 ($add).
  creating $macc model for $flatten\x56.$add$/openlane/designs/bka/src/bka.v:1018$5 ($add).
  creating $macc model for $flatten\x57.$add$/openlane/designs/bka/src/bka.v:1018$5 ($add).
  creating $macc model for $flatten\x58.$add$/openlane/designs/bka/src/bka.v:1018$5 ($add).
  creating $macc model for $flatten\x59.$add$/openlane/designs/bka/src/bka.v:1018$5 ($add).
  creating $macc model for $flatten\x60.$add$/openlane/designs/bka/src/bka.v:1018$5 ($add).
  creating $macc model for $flatten\x61.$add$/openlane/designs/bka/src/bka.v:1018$5 ($add).
  creating $macc model for $flatten\x62.$add$/openlane/designs/bka/src/bka.v:1018$5 ($add).
  creating $macc model for $flatten\x63.$add$/openlane/designs/bka/src/bka.v:1018$5 ($add).
  creating $macc model for $flatten\x64.$add$/openlane/designs/bka/src/bka.v:1018$5 ($add).
  merging $macc model for $flatten\x19.$add$/openlane/designs/bka/src/bka.v:1018$5 into $flatten\x62.$add$/openlane/designs/bka/src/bka.v:1018$5.
  merging $macc model for $flatten\x21.$add$/openlane/designs/bka/src/bka.v:1018$5 into $flatten\x60.$add$/openlane/designs/bka/src/bka.v:1018$5.
  merging $macc model for $flatten\x22.$add$/openlane/designs/bka/src/bka.v:1018$5 into $flatten\x59.$add$/openlane/designs/bka/src/bka.v:1018$5.
  merging $macc model for $flatten\x23.$add$/openlane/designs/bka/src/bka.v:1018$5 into $flatten\x58.$add$/openlane/designs/bka/src/bka.v:1018$5.
  merging $macc model for $flatten\x48.$add$/openlane/designs/bka/src/bka.v:1018$5 into $flatten\x56.$add$/openlane/designs/bka/src/bka.v:1018$5.
  merging $macc model for $flatten\x46.$add$/openlane/designs/bka/src/bka.v:1018$5 into $flatten\x54.$add$/openlane/designs/bka/src/bka.v:1018$5.
  merging $macc model for $flatten\x44.$add$/openlane/designs/bka/src/bka.v:1018$5 into $flatten\x52.$add$/openlane/designs/bka/src/bka.v:1018$5.
  merging $macc model for $flatten\x42.$add$/openlane/designs/bka/src/bka.v:1018$5 into $flatten\x50.$add$/openlane/designs/bka/src/bka.v:1018$5.
  merging $macc model for $flatten\x41.$add$/openlane/designs/bka/src/bka.v:1018$5 into $flatten\x49.$add$/openlane/designs/bka/src/bka.v:1018$5.
  merging $macc model for $flatten\x32.$add$/openlane/designs/bka/src/bka.v:1018$5 into $flatten\x49.$add$/openlane/designs/bka/src/bka.v:1018$5.
  merging $macc model for $flatten\x40.$add$/openlane/designs/bka/src/bka.v:1018$5 into $flatten\x49.$add$/openlane/designs/bka/src/bka.v:1018$5.
  merging $macc model for $flatten\x38.$add$/openlane/designs/bka/src/bka.v:1018$5 into $flatten\x49.$add$/openlane/designs/bka/src/bka.v:1018$5.
  merging $macc model for $flatten\x26.$add$/openlane/designs/bka/src/bka.v:1018$5 into $flatten\x28.$add$/openlane/designs/bka/src/bka.v:1018$5.
  merging $macc model for $flatten\x28.$add$/openlane/designs/bka/src/bka.v:1018$5 into $flatten\x24.$add$/openlane/designs/bka/src/bka.v:1018$5.
  merging $macc model for $flatten\x18.$add$/openlane/designs/bka/src/bka.v:1018$5 into $flatten\x20.$add$/openlane/designs/bka/src/bka.v:1018$5.
  merging $macc model for $flatten\x14.$add$/openlane/designs/bka/src/bka.v:1018$5 into $flatten\x16.$add$/openlane/designs/bka/src/bka.v:1018$5.
  creating $alu model for $macc $flatten\x53.$add$/openlane/designs/bka/src/bka.v:1018$5.
  creating $alu model for $macc $flatten\x47.$add$/openlane/designs/bka/src/bka.v:1018$5.
  creating $alu model for $macc $flatten\x54.$add$/openlane/designs/bka/src/bka.v:1018$5.
  creating $alu model for $macc $flatten\x45.$add$/openlane/designs/bka/src/bka.v:1018$5.
  creating $alu model for $macc $flatten\x55.$add$/openlane/designs/bka/src/bka.v:1018$5.
  creating $alu model for $macc $flatten\x43.$add$/openlane/designs/bka/src/bka.v:1018$5.
  creating $alu model for $macc $flatten\x56.$add$/openlane/designs/bka/src/bka.v:1018$5.
  creating $alu model for $macc $flatten\x57.$add$/openlane/designs/bka/src/bka.v:1018$5.
  creating $alu model for $macc $flatten\x59.$add$/openlane/designs/bka/src/bka.v:1018$5.
  creating $alu model for $macc $flatten\x60.$add$/openlane/designs/bka/src/bka.v:1018$5.
  creating $alu model for $macc $flatten\x37.$add$/openlane/designs/bka/src/bka.v:1018$5.
  creating $alu model for $macc $flatten\x58.$add$/openlane/designs/bka/src/bka.v:1018$5.
  creating $alu model for $macc $flatten\x62.$add$/openlane/designs/bka/src/bka.v:1018$5.
  creating $alu model for $macc $flatten\x61.$add$/openlane/designs/bka/src/bka.v:1018$5.
  creating $alu model for $macc $flatten\x25.$add$/openlane/designs/bka/src/bka.v:1018$5.
  creating $alu model for $macc $flatten\x52.$add$/openlane/designs/bka/src/bka.v:1018$5.
  creating $alu model for $macc $flatten\x51.$add$/openlane/designs/bka/src/bka.v:1018$5.
  creating $alu model for $macc $flatten\x50.$add$/openlane/designs/bka/src/bka.v:1018$5.
  creating $alu model for $macc $flatten\x20.$add$/openlane/designs/bka/src/bka.v:1018$5.
  creating $alu model for $macc $flatten\x63.$add$/openlane/designs/bka/src/bka.v:1018$5.
  creating $alu model for $macc $flatten\x17.$add$/openlane/designs/bka/src/bka.v:1018$5.
  creating $alu model for $macc $flatten\x16.$add$/openlane/designs/bka/src/bka.v:1018$5.
  creating $alu model for $macc $flatten\x64.$add$/openlane/designs/bka/src/bka.v:1018$5.
  creating $alu model for $macc $flatten\x13.$add$/openlane/designs/bka/src/bka.v:1018$5.
  creating $macc cell for $flatten\x49.$add$/openlane/designs/bka/src/bka.v:1018$5: $auto$alumacc.cc:365:replace_macc$13
  creating $macc cell for $flatten\x24.$add$/openlane/designs/bka/src/bka.v:1018$5: $auto$alumacc.cc:365:replace_macc$14
  creating $alu cell for $flatten\x13.$add$/openlane/designs/bka/src/bka.v:1018$5: $auto$alumacc.cc:485:replace_alu$15
  creating $alu cell for $flatten\x64.$add$/openlane/designs/bka/src/bka.v:1018$5: $auto$alumacc.cc:485:replace_alu$18
  creating $alu cell for $flatten\x16.$add$/openlane/designs/bka/src/bka.v:1018$5: $auto$alumacc.cc:485:replace_alu$21
  creating $alu cell for $flatten\x17.$add$/openlane/designs/bka/src/bka.v:1018$5: $auto$alumacc.cc:485:replace_alu$24
  creating $alu cell for $flatten\x63.$add$/openlane/designs/bka/src/bka.v:1018$5: $auto$alumacc.cc:485:replace_alu$27
  creating $alu cell for $flatten\x20.$add$/openlane/designs/bka/src/bka.v:1018$5: $auto$alumacc.cc:485:replace_alu$30
  creating $alu cell for $flatten\x50.$add$/openlane/designs/bka/src/bka.v:1018$5: $auto$alumacc.cc:485:replace_alu$33
  creating $alu cell for $flatten\x51.$add$/openlane/designs/bka/src/bka.v:1018$5: $auto$alumacc.cc:485:replace_alu$36
  creating $alu cell for $flatten\x52.$add$/openlane/designs/bka/src/bka.v:1018$5: $auto$alumacc.cc:485:replace_alu$39
  creating $alu cell for $flatten\x25.$add$/openlane/designs/bka/src/bka.v:1018$5: $auto$alumacc.cc:485:replace_alu$42
  creating $alu cell for $flatten\x61.$add$/openlane/designs/bka/src/bka.v:1018$5: $auto$alumacc.cc:485:replace_alu$45
  creating $alu cell for $flatten\x62.$add$/openlane/designs/bka/src/bka.v:1018$5: $auto$alumacc.cc:485:replace_alu$48
  creating $alu cell for $flatten\x58.$add$/openlane/designs/bka/src/bka.v:1018$5: $auto$alumacc.cc:485:replace_alu$51
  creating $alu cell for $flatten\x37.$add$/openlane/designs/bka/src/bka.v:1018$5: $auto$alumacc.cc:485:replace_alu$54
  creating $alu cell for $flatten\x60.$add$/openlane/designs/bka/src/bka.v:1018$5: $auto$alumacc.cc:485:replace_alu$57
  creating $alu cell for $flatten\x59.$add$/openlane/designs/bka/src/bka.v:1018$5: $auto$alumacc.cc:485:replace_alu$60
  creating $alu cell for $flatten\x57.$add$/openlane/designs/bka/src/bka.v:1018$5: $auto$alumacc.cc:485:replace_alu$63
  creating $alu cell for $flatten\x56.$add$/openlane/designs/bka/src/bka.v:1018$5: $auto$alumacc.cc:485:replace_alu$66
  creating $alu cell for $flatten\x43.$add$/openlane/designs/bka/src/bka.v:1018$5: $auto$alumacc.cc:485:replace_alu$69
  creating $alu cell for $flatten\x55.$add$/openlane/designs/bka/src/bka.v:1018$5: $auto$alumacc.cc:485:replace_alu$72
  creating $alu cell for $flatten\x45.$add$/openlane/designs/bka/src/bka.v:1018$5: $auto$alumacc.cc:485:replace_alu$75
  creating $alu cell for $flatten\x54.$add$/openlane/designs/bka/src/bka.v:1018$5: $auto$alumacc.cc:485:replace_alu$78
  creating $alu cell for $flatten\x47.$add$/openlane/designs/bka/src/bka.v:1018$5: $auto$alumacc.cc:485:replace_alu$81
  creating $alu cell for $flatten\x53.$add$/openlane/designs/bka/src/bka.v:1018$5: $auto$alumacc.cc:485:replace_alu$84
  created 24 $alu and 2 $macc cells.

31. Executing SHARE pass (SAT-based resource sharing).

32. Executing OPT pass (performing simple optimizations).

32.1. Executing OPT_EXPR pass (perform const folding).
Optimizing module bka.

32.2. Executing OPT_MERGE pass (detect identical cells).
Finding identical cells in module `\bka'.
Removed a total of 0 cells.

32.3. Executing OPT_MUXTREE pass (detect dead branches in mux trees).
Running muxtree optimizer on module \bka..
  Creating internal representation of mux trees.
  No muxes found in this module.
Removed 0 multiplexer ports.

32.4. Executing OPT_REDUCE pass (consolidate $*mux and $reduce_* inputs).
  Optimizing cells in module \bka.
Performed a total of 0 changes.

32.5. Executing OPT_MERGE pass (detect identical cells).
Finding identical cells in module `\bka'.
Removed a total of 0 cells.

32.6. Executing OPT_DFF pass (perform DFF optimizations).

32.7. Executing OPT_CLEAN pass (remove unused cells and wires).
Finding unused cells or wires in module \bka..
Removed 16 unused cells and 0 unused wires.
<suppressed ~16 debug messages>

32.8. Executing OPT_EXPR pass (perform const folding).
Optimizing module bka.

32.9. Rerunning OPT passes. (Maybe there is more to do..)

32.10. Executing OPT_MUXTREE pass (detect dead branches in mux trees).
Running muxtree optimizer on module \bka..
  Creating internal representation of mux trees.
  No muxes found in this module.
Removed 0 multiplexer ports.

32.11. Executing OPT_REDUCE pass (consolidate $*mux and $reduce_* inputs).
  Optimizing cells in module \bka.
Performed a total of 0 changes.

32.12. Executing OPT_MERGE pass (detect identical cells).
Finding identical cells in module `\bka'.
Removed a total of 0 cells.

32.13. Executing OPT_DFF pass (perform DFF optimizations).

32.14. Executing OPT_CLEAN pass (remove unused cells and wires).
Finding unused cells or wires in module \bka..

32.15. Executing OPT_EXPR pass (perform const folding).
Optimizing module bka.

32.16. Finished OPT passes. (There is nothing left to do.)

33. Executing MEMORY pass.

33.1. Executing OPT_MEM pass (optimize memories).
Performed a total of 0 transformations.

33.2. Executing OPT_MEM_PRIORITY pass (removing unnecessary memory write priority relations).
Performed a total of 0 transformations.

33.3. Executing OPT_MEM_FEEDBACK pass (finding memory read-to-write feedback paths).

33.4. Executing MEMORY_BMUX2ROM pass (converting muxes to ROMs).

33.5. Executing MEMORY_DFF pass (merging $dff cells to $memrd).

33.6. Executing OPT_CLEAN pass (remove unused cells and wires).
Finding unused cells or wires in module \bka..

33.7. Executing MEMORY_SHARE pass (consolidating $memrd/$memwr cells).

33.8. Executing OPT_MEM_WIDEN pass (optimize memories where all ports are wide).
Performed a total of 0 transformations.

33.9. Executing OPT_CLEAN pass (remove unused cells and wires).
Finding unused cells or wires in module \bka..

33.10. Executing MEMORY_COLLECT pass (generating $mem cells).

34. Executing OPT_CLEAN pass (remove unused cells and wires).
Finding unused cells or wires in module \bka..

35. Executing OPT pass (performing simple optimizations).

35.1. Executing OPT_EXPR pass (perform const folding).
Optimizing module bka.
<suppressed ~16 debug messages>

35.2. Executing OPT_MERGE pass (detect identical cells).
Finding identical cells in module `\bka'.
Removed a total of 0 cells.

35.3. Executing OPT_DFF pass (perform DFF optimizations).

35.4. Executing OPT_CLEAN pass (remove unused cells and wires).
Finding unused cells or wires in module \bka..

35.5. Finished fast OPT passes.

36. Executing MEMORY_MAP pass (converting memories to logic and flip-flops).

37. Executing OPT pass (performing simple optimizations).

37.1. Executing OPT_EXPR pass (perform const folding).
Optimizing module bka.

37.2. Executing OPT_MERGE pass (detect identical cells).
Finding identical cells in module `\bka'.
Removed a total of 0 cells.

37.3. Executing OPT_MUXTREE pass (detect dead branches in mux trees).
Running muxtree optimizer on module \bka..
  Creating internal representation of mux trees.
  No muxes found in this module.
Removed 0 multiplexer ports.

37.4. Executing OPT_REDUCE pass (consolidate $*mux and $reduce_* inputs).
  Optimizing cells in module \bka.
Performed a total of 0 changes.

37.5. Executing OPT_MERGE pass (detect identical cells).
Finding identical cells in module `\bka'.
Removed a total of 0 cells.

37.6. Executing OPT_SHARE pass.

37.7. Executing OPT_DFF pass (perform DFF optimizations).

37.8. Executing OPT_CLEAN pass (remove unused cells and wires).
Finding unused cells or wires in module \bka..

37.9. Executing OPT_EXPR pass (perform const folding).
Optimizing module bka.

37.10. Finished OPT passes. (There is nothing left to do.)

38. Executing TECHMAP pass (map to technology primitives).

38.1. Executing Verilog-2005 frontend: /nix/store/sx2v0i73mn1ih2z1nk61pm9n5gjgpidy-yosys/bin/../share/yosys/techmap.v
Parsing Verilog input from `/nix/store/sx2v0i73mn1ih2z1nk61pm9n5gjgpidy-yosys/bin/../share/yosys/techmap.v' to AST representation.
Generating RTLIL representation for module `\_90_simplemap_bool_ops'.
Generating RTLIL representation for module `\_90_simplemap_reduce_ops'.
Generating RTLIL representation for module `\_90_simplemap_logic_ops'.
Generating RTLIL representation for module `\_90_simplemap_compare_ops'.
Generating RTLIL representation for module `\_90_simplemap_various'.
Generating RTLIL representation for module `\_90_simplemap_registers'.
Generating RTLIL representation for module `\_90_shift_ops_shr_shl_sshl_sshr'.
Generating RTLIL representation for module `\_90_shift_shiftx'.
Generating RTLIL representation for module `\_90_fa'.
Generating RTLIL representation for module `\_90_lcu'.
Generating RTLIL representation for module `\_90_alu'.
Generating RTLIL representation for module `\_90_macc'.
Generating RTLIL representation for module `\_90_alumacc'.
Generating RTLIL representation for module `\$__div_mod_u'.
Generating RTLIL representation for module `\$__div_mod_trunc'.
Generating RTLIL representation for module `\_90_div'.
Generating RTLIL representation for module `\_90_mod'.
Generating RTLIL representation for module `\$__div_mod_floor'.
Generating RTLIL representation for module `\_90_divfloor'.
Generating RTLIL representation for module `\_90_modfloor'.
Generating RTLIL representation for module `\_90_pow'.
Generating RTLIL representation for module `\_90_pmux'.
Generating RTLIL representation for module `\_90_demux'.
Generating RTLIL representation for module `\_90_lut'.
Successfully finished Verilog frontend.

38.2. Continuing TECHMAP pass.
Using extmapper simplemap for cells of type $dff.
Using extmapper simplemap for cells of type $and.
Using extmapper simplemap for cells of type $xor.
Using template $paramod$fc972a7a46956c1788f3cb5257b53c8f1df2d0cc\_90_alu for cells of type $alu.
Using extmapper maccmap for cells of type $macc.
  add bits { $flatten\x26.$and$/openlane/designs/bka/src/bka.v:1018$4_Y $flatten\x28.$and$/openlane/designs/bka/src/bka.v:1018$4_Y $flatten\x24.$and$/openlane/designs/bka/src/bka.v:1018$4_Y \x26.G2 } (4 bits)
  packed 1 (1) bits / 1 words into adder tree
  add bits { $flatten\x38.$and$/openlane/designs/bka/src/bka.v:1018$4_Y $flatten\x40.$and$/openlane/designs/bka/src/bka.v:1018$4_Y $flatten\x32.$and$/openlane/designs/bka/src/bka.v:1018$4_Y $flatten\x41.$and$/openlane/designs/bka/src/bka.v:1018$4_Y $flatten\x49.$and$/openlane/designs/bka/src/bka.v:1018$4_Y \x38.G2 } (6 bits)
  packed 2 (2) bits / 2 words into adder tree
Using template $paramod\_90_lcu\WIDTH=32'00000000000000000000000000000001 for cells of type $lcu.
Using extmapper simplemap for cells of type $pos.
Using extmapper simplemap for cells of type $mux.
Using extmapper simplemap for cells of type $not.
Using template $paramod\_90_fa\WIDTH=32'00000000000000000000000000000001 for cells of type $fa.
Using extmapper simplemap for cells of type $or.
No more expansions possible.
<suppressed ~636 debug messages>

39. Executing OPT pass (performing simple optimizations).

39.1. Executing OPT_EXPR pass (perform const folding).
Optimizing module bka.
<suppressed ~100 debug messages>

39.2. Executing OPT_MERGE pass (detect identical cells).
Finding identical cells in module `\bka'.
Removed a total of 0 cells.

39.3. Executing OPT_DFF pass (perform DFF optimizations).

39.4. Executing OPT_CLEAN pass (remove unused cells and wires).
Finding unused cells or wires in module \bka..
Removed 81 unused cells and 733 unused wires.
<suppressed ~82 debug messages>

39.5. Finished fast OPT passes.

40. Executing ABC pass (technology mapping using ABC).

40.1. Extracting gate netlist of module `\bka' to `<abc-temp-dir>/input.blif'..
Extracted 158 gates and 191 wires to a netlist network with 33 inputs and 17 outputs.

40.1.1. Executing ABC.
Running ABC command: "/nix/store/wq2q0njg3sx8wvj2akz7x1qxwyrv9xlr-yosys-abc/bin/abc" -s -f <abc-temp-dir>/abc.script 2>&1
ABC: ABC command line: "source <abc-temp-dir>/abc.script".
ABC: 
ABC: + read_blif <abc-temp-dir>/input.blif 
ABC: + read_library <abc-temp-dir>/stdcells.genlib 
ABC: Entered genlib library with 13 gates from file "<abc-temp-dir>/stdcells.genlib".
ABC: + strash 
ABC: + dretime 
ABC: + map 
ABC: + write_blif <abc-temp-dir>/output.blif 

40.1.2. Re-integrating ABC results.
ABC RESULTS:               NOT cells:        1
ABC RESULTS:              XNOR cells:       18
ABC RESULTS:              NAND cells:        8
ABC RESULTS:             ORNOT cells:        5
ABC RESULTS:               NOR cells:       20
ABC RESULTS:                OR cells:       22
ABC RESULTS:            ANDNOT cells:       20
ABC RESULTS:               AND cells:        9
ABC RESULTS:               XOR cells:       56
ABC RESULTS:        internal signals:      141
ABC RESULTS:           input signals:       33
ABC RESULTS:          output signals:       17
Removing temp directory.

41. Executing OPT pass (performing simple optimizations).

41.1. Executing OPT_EXPR pass (perform const folding).
Optimizing module bka.

41.2. Executing OPT_MERGE pass (detect identical cells).
Finding identical cells in module `\bka'.
Removed a total of 0 cells.

41.3. Executing OPT_DFF pass (perform DFF optimizations).

41.4. Executing OPT_CLEAN pass (remove unused cells and wires).
Finding unused cells or wires in module \bka..
Removed 0 unused cells and 108 unused wires.
<suppressed ~1 debug messages>

41.5. Finished fast OPT passes.

42. Executing HIERARCHY pass (managing design hierarchy).

42.1. Analyzing design hierarchy..
Top module:  \bka

42.2. Analyzing design hierarchy..
Top module:  \bka
Removed 0 unused modules.

43. Printing statistics.

=== bka ===

   Number of wires:                681
   Number of wire bits:            771
   Number of public wires:         539
   Number of public wire bits:     629
   Number of memories:               0
   Number of memory bits:            0
   Number of processes:              0
   Number of cells:                209
     $_ANDNOT_                      20
     $_AND_                          9
     $_DFF_P_                       50
     $_NAND_                         8
     $_NOR_                         20
     $_NOT_                          1
     $_ORNOT_                        5
     $_OR_                          22
     $_XNOR_                        18
     $_XOR_                         56

44. Executing CHECK pass (checking for obvious problems).
Checking module bka...
Found and reported 0 problems.

45. Generating Graphviz representation of design.
Writing dot description to `/openlane/designs/bka/runs/auto_pnr/tmp/synthesis/post_techmap.dot'.
Dumping module bka to page 1.

46. Executing SHARE pass (SAT-based resource sharing).

47. Executing OPT pass (performing simple optimizations).

47.1. Executing OPT_EXPR pass (perform const folding).
Optimizing module bka.

47.2. Executing OPT_MERGE pass (detect identical cells).
Finding identical cells in module `\bka'.
Removed a total of 0 cells.

47.3. Executing OPT_MUXTREE pass (detect dead branches in mux trees).
Running muxtree optimizer on module \bka..
  Creating internal representation of mux trees.
  No muxes found in this module.
Removed 0 multiplexer ports.

47.4. Executing OPT_REDUCE pass (consolidate $*mux and $reduce_* inputs).
  Optimizing cells in module \bka.
Performed a total of 0 changes.

47.5. Executing OPT_MERGE pass (detect identical cells).
Finding identical cells in module `\bka'.
Removed a total of 0 cells.

47.6. Executing OPT_DFF pass (perform DFF optimizations).

47.7. Executing OPT_CLEAN pass (remove unused cells and wires).
Finding unused cells or wires in module \bka..

47.8. Executing OPT_EXPR pass (perform const folding).
Optimizing module bka.

47.9. Finished OPT passes. (There is nothing left to do.)

48. Executing OPT_CLEAN pass (remove unused cells and wires).
Finding unused cells or wires in module \bka..
Removed 0 unused cells and 483 unused wires.
<suppressed ~483 debug messages>

49. Printing statistics.

=== bka ===

   Number of wires:                198
   Number of wire bits:            243
   Number of public wires:          56
   Number of public wire bits:     101
   Number of memories:               0
   Number of memory bits:            0
   Number of processes:              0
   Number of cells:                209
     $_ANDNOT_                      20
     $_AND_                          9
     $_DFF_P_                       50
     $_NAND_                         8
     $_NOR_                         20
     $_NOT_                          1
     $_ORNOT_                        5
     $_OR_                          22
     $_XNOR_                        18
     $_XOR_                         56

mapping tbuf

50. Executing TECHMAP pass (map to technology primitives).

50.1. Executing Verilog-2005 frontend: /volare/sky130A/libs.tech/openlane/sky130_fd_sc_hd/tribuff_map.v
Parsing Verilog input from `/volare/sky130A/libs.tech/openlane/sky130_fd_sc_hd/tribuff_map.v' to AST representation.
Generating RTLIL representation for module `\$_TBUF_'.
Successfully finished Verilog frontend.

50.2. Continuing TECHMAP pass.
No more expansions possible.
<suppressed ~3 debug messages>

51. Executing SIMPLEMAP pass (map simple cells to gate primitives).

52. Executing TECHMAP pass (map to technology primitives).

52.1. Executing Verilog-2005 frontend: /volare/sky130A/libs.tech/openlane/sky130_fd_sc_hd/latch_map.v
Parsing Verilog input from `/volare/sky130A/libs.tech/openlane/sky130_fd_sc_hd/latch_map.v' to AST representation.
Generating RTLIL representation for module `\$_DLATCH_P_'.
Generating RTLIL representation for module `\$_DLATCH_N_'.
Successfully finished Verilog frontend.

52.2. Continuing TECHMAP pass.
No more expansions possible.
<suppressed ~4 debug messages>

53. Executing SIMPLEMAP pass (map simple cells to gate primitives).

54. Executing DFFLIBMAP pass (mapping DFF cells to sequential cells from liberty file).
  cell sky130_fd_sc_hd__dfxtp_2 (noninv, pins=3, area=21.27) is a direct match for cell type $_DFF_P_.
  cell sky130_fd_sc_hd__dfrtp_2 (noninv, pins=4, area=26.28) is a direct match for cell type $_DFF_PN0_.
  cell sky130_fd_sc_hd__dfstp_2 (noninv, pins=4, area=26.28) is a direct match for cell type $_DFF_PN1_.
  cell sky130_fd_sc_hd__dfbbn_2 (noninv, pins=6, area=35.03) is a direct match for cell type $_DFFSR_NNN_.
  final dff cell mappings:
    unmapped dff cell: $_DFF_N_
    \sky130_fd_sc_hd__dfxtp_2 _DFF_P_ (.CLK( C), .D( D), .Q( Q));
    unmapped dff cell: $_DFF_NN0_
    unmapped dff cell: $_DFF_NN1_
    unmapped dff cell: $_DFF_NP0_
    unmapped dff cell: $_DFF_NP1_
    \sky130_fd_sc_hd__dfrtp_2 _DFF_PN0_ (.CLK( C), .D( D), .Q( Q), .RESET_B( R));
    \sky130_fd_sc_hd__dfstp_2 _DFF_PN1_ (.CLK( C), .D( D), .Q( Q), .SET_B( R));
    unmapped dff cell: $_DFF_PP0_
    unmapped dff cell: $_DFF_PP1_
    \sky130_fd_sc_hd__dfbbn_2 _DFFSR_NNN_ (.CLK_N( C), .D( D), .Q( Q), .Q_N(~Q), .RESET_B( R), .SET_B( S));
    unmapped dff cell: $_DFFSR_NNP_
    unmapped dff cell: $_DFFSR_NPN_
    unmapped dff cell: $_DFFSR_NPP_
    unmapped dff cell: $_DFFSR_PNN_
    unmapped dff cell: $_DFFSR_PNP_
    unmapped dff cell: $_DFFSR_PPN_
    unmapped dff cell: $_DFFSR_PPP_

54.1. Executing DFFLEGALIZE pass (convert FFs to types supported by the target).
Mapping DFF cells in module `\bka':
  mapped 50 $_DFF_P_ cells to \sky130_fd_sc_hd__dfxtp_2 cells.

55. Printing statistics.

=== bka ===

   Number of wires:                198
   Number of wire bits:            243
   Number of public wires:          56
   Number of public wire bits:     101
   Number of memories:               0
   Number of memory bits:            0
   Number of processes:              0
   Number of cells:                209
     $_ANDNOT_                      20
     $_AND_                          9
     $_NAND_                         8
     $_NOR_                         20
     $_NOT_                          1
     $_ORNOT_                        5
     $_OR_                          22
     $_XNOR_                        18
     $_XOR_                         56
     sky130_fd_sc_hd__dfxtp_2       50

[INFO]: USING STRATEGY AREA 0

56. Executing ABC pass (technology mapping using ABC).

56.1. Extracting gate netlist of module `\bka' to `/tmp/yosys-abc-XColcl/input.blif'..
Extracted 159 gates and 192 wires to a netlist network with 33 inputs and 17 outputs.

56.1.1. Executing ABC.
Running ABC command: "/nix/store/wq2q0njg3sx8wvj2akz7x1qxwyrv9xlr-yosys-abc/bin/abc" -s -f /tmp/yosys-abc-XColcl/abc.script 2>&1
ABC: ABC command line: "source /tmp/yosys-abc-XColcl/abc.script".
ABC: 
ABC: + read_blif /tmp/yosys-abc-XColcl/input.blif 
ABC: + read_lib -w /openlane/designs/bka/runs/auto_pnr/tmp/synthesis/trimmed.lib 
ABC: Parsing finished successfully.  Parsing time =     0.03 sec
ABC: Scl_LibertyReadGenlib() skipped sequential cell "sky130_fd_sc_hd__dfbbn_2".
ABC: Scl_LibertyReadGenlib() skipped sequential cell "sky130_fd_sc_hd__dfrbp_2".
ABC: Scl_LibertyReadGenlib() skipped sequential cell "sky130_fd_sc_hd__dfrtp_2".
ABC: Scl_LibertyReadGenlib() skipped sequential cell "sky130_fd_sc_hd__dfrtp_4".
ABC: Scl_LibertyReadGenlib() skipped sequential cell "sky130_fd_sc_hd__dfsbp_2".
ABC: Scl_LibertyReadGenlib() skipped sequential cell "sky130_fd_sc_hd__dfstp_2".
ABC: Scl_LibertyReadGenlib() skipped sequential cell "sky130_fd_sc_hd__dfstp_4".
ABC: Scl_LibertyReadGenlib() skipped sequential cell "sky130_fd_sc_hd__dfxbp_2".
ABC: Scl_LibertyReadGenlib() skipped sequential cell "sky130_fd_sc_hd__dfxtp_2".
ABC: Scl_LibertyReadGenlib() skipped sequential cell "sky130_fd_sc_hd__dfxtp_4".
ABC: Scl_LibertyReadGenlib() skipped sequential cell "sky130_fd_sc_hd__dlxtn_1".
ABC: Scl_LibertyReadGenlib() skipped sequential cell "sky130_fd_sc_hd__dlxtn_2".
ABC: Scl_LibertyReadGenlib() skipped sequential cell "sky130_fd_sc_hd__dlxtn_4".
ABC: Scl_LibertyReadGenlib() skipped sequential cell "sky130_fd_sc_hd__dlxtp_1".
ABC: Scl_LibertyReadGenlib() skipped three-state cell "sky130_fd_sc_hd__ebufn_2".
ABC: Scl_LibertyReadGenlib() skipped three-state cell "sky130_fd_sc_hd__ebufn_4".
ABC: Scl_LibertyReadGenlib() skipped three-state cell "sky130_fd_sc_hd__ebufn_8".
ABC: Library "sky130A_merged" from "/openlane/designs/bka/runs/auto_pnr/tmp/synthesis/trimmed.lib" has 175 cells (17 skipped: 14 seq; 3 tri-state; 0 no func; 0 dont_use).  Time =     0.04 sec
ABC: Memory =    9.54 MB. Time =     0.04 sec
ABC: Warning: Detected 2 multi-output gates (for example, "sky130_fd_sc_hd__fa_1").
ABC: + read_constr -v /openlane/designs/bka/runs/auto_pnr/tmp/synthesis/synthesis.sdc 
ABC: Setting driving cell to be "sky130_fd_sc_hd__inv_2".
ABC: Setting output load to be 33.442001.
ABC: + read_constr /openlane/designs/bka/runs/auto_pnr/tmp/synthesis/synthesis.sdc 
ABC: + fx 
ABC: + mfs 
ABC: + strash 
ABC: + drf -l 
ABC: + balance 
ABC: + drw -l 
ABC: + drf -l 
ABC: + balance 
ABC: + drw -l 
ABC: + drw -l -z 
ABC: + balance 
ABC: + drf -l -z 
ABC: + drw -l -z 
ABC: + balance 
ABC: + retime -D -D 4750.0 -M 5 
ABC: + scleanup 
ABC: Error: The network is combinational.
ABC: + fraig_store 
ABC: + balance 
ABC: + fraig_store 
ABC: + balance 
ABC: + drw -l 
ABC: + drf -l 
ABC: + balance 
ABC: + drw -l 
ABC: + drw -l -z 
ABC: + balance 
ABC: + drf -l -z 
ABC: + drw -l -z 
ABC: + balance 
ABC: + fraig_store 
ABC: + balance 
ABC: + drw -l 
ABC: + drf -l 
ABC: + balance 
ABC: + drw -l 
ABC: + drw -l -z 
ABC: + balance 
ABC: + drf -l -z 
ABC: + drw -l -z 
ABC: + balance 
ABC: + fraig_store 
ABC: + balance 
ABC: + drw -l 
ABC: + drf -l 
ABC: + balance 
ABC: + drw -l 
ABC: + drw -l -z 
ABC: + balance 
ABC: + drf -l -z 
ABC: + drw -l -z 
ABC: + balance 
ABC: + fraig_store 
ABC: + fraig_restore 
ABC: + amap -m -Q 0.1 -F 20 -A 20 -C 5000 
ABC: + retime -D -D 4750.0 
ABC: + &get -n 
ABC: + &st 
ABC: + &dch 
ABC: + &nf 
ABC: + &put 
ABC: + buffer -N 10 -S 750.0 
ABC: + upsize -D 4750.0 
ABC: Current delay (2464.00 ps) does not exceed the target delay (4750.00 ps). Upsizing is not performed.
ABC: + dnsize -D 4750.0 
ABC: + stime -p 
ABC: WireLoad = "none"  Gates =    104 (  1.9 %)   Cap = 11.2 ff (  0.4 %)   Area =      960.92 ( 98.1 %)   Delay =  2422.22 ps  ( 11.5 %)               
ABC: Path  0 --       2 : 0    3 pi                       A =   0.00  Df =  29.3  -16.4 ps  S =  46.2 ps  Cin =  0.0 ff  Cout =   8.6 ff  Cmax =   0.0 ff  G =    0  
ABC: Path  1 --      63 : 2    3 sky130_fd_sc_hd__or2_2   A =   6.26  Df = 316.0 -167.7 ps  S =  71.3 ps  Cin =  1.5 ff  Cout =   8.7 ff  Cmax = 299.4 ff  G =  576  
ABC: Path  2 --      64 : 4    2 sky130_fd_sc_hd__and4_2  A =  10.01  Df = 573.5  -42.5 ps  S =  83.7 ps  Cin =  1.5 ff  Cout =   9.3 ff  Cmax = 300.3 ff  G =  582  
ABC: Path  3 --      72 : 4    5 sky130_fd_sc_hd__o31ai_2 A =  12.51  Df =1077.4 -410.1 ps  S = 536.6 ps  Cin =  4.4 ff  Cout =  24.9 ff  Cmax =  80.6 ff  G =  536  
ABC: Path  4 --      82 : 5    4 sky130_fd_sc_hd__o41ai_2 A =  16.27  Df =1375.0  -86.8 ps  S = 473.2 ps  Cin =  4.3 ff  Cout =  14.9 ff  Cmax =  62.3 ff  G =  329  
ABC: Path  5 --      94 : 4    2 sky130_fd_sc_hd__and4_2  A =  10.01  Df =1702.1 -187.8 ps  S =  75.4 ps  Cin =  1.5 ff  Cout =   6.6 ff  Cmax = 300.3 ff  G =  416  
ABC: Path  6 --     115 : 2    2 sky130_fd_sc_hd__or2_2   A =   6.26  Df =1842.3   -3.1 ps  S =  79.0 ps  Cin =  1.5 ff  Cout =  11.5 ff  Cmax = 299.4 ff  G =  763  
ABC: Path  7 --     116 : 3    1 sky130_fd_sc_hd__a21bo_2 A =  10.01  Df =2056.3  -70.3 ps  S =  60.7 ps  Cin =  2.0 ff  Cout =   8.4 ff  Cmax = 288.4 ff  G =  406  
ABC: Path  8 --     117 : 2    1 sky130_fd_sc_hd__xnor2_2 A =  16.27  Df =2422.2 -212.9 ps  S = 453.8 ps  Cin =  8.5 ff  Cout =  33.4 ff  Cmax = 121.8 ff  G =  394  
ABC: Start-point = pi1 (\x8.B).  End-point = po2 (\x67.Si).
ABC: + print_stats -m 
ABC: netlist                       : i/o =   33/   17  lat =    0  nd =   104  edge =    255  area =961.21  delay = 8.00  lev = 8
ABC: + write_blif /tmp/yosys-abc-XColcl/output.blif 

56.1.2. Re-integrating ABC results.
ABC RESULTS:   sky130_fd_sc_hd__inv_2 cells:        1
ABC RESULTS:   sky130_fd_sc_hd__and3_2 cells:        1
ABC RESULTS:   sky130_fd_sc_hd__o41ai_2 cells:        1
ABC RESULTS:   sky130_fd_sc_hd__and2b_2 cells:        1
ABC RESULTS:   sky130_fd_sc_hd__and4_2 cells:        2
ABC RESULTS:   sky130_fd_sc_hd__a31o_2 cells:        2
ABC RESULTS:   sky130_fd_sc_hd__o21ai_2 cells:        2
ABC RESULTS:   sky130_fd_sc_hd__or2_2 cells:       13
ABC RESULTS:   sky130_fd_sc_hd__a21bo_2 cells:        2
ABC RESULTS:   sky130_fd_sc_hd__o21a_2 cells:        3
ABC RESULTS:   sky130_fd_sc_hd__a22o_2 cells:        4
ABC RESULTS:   sky130_fd_sc_hd__a21oi_2 cells:        4
ABC RESULTS:   sky130_fd_sc_hd__o22ai_2 cells:        1
ABC RESULTS:   sky130_fd_sc_hd__o21bai_2 cells:        2
ABC RESULTS:   sky130_fd_sc_hd__xnor2_2 cells:       10
ABC RESULTS:   sky130_fd_sc_hd__nand3_2 cells:        1
ABC RESULTS:   sky130_fd_sc_hd__nand2_2 cells:       16
ABC RESULTS:   sky130_fd_sc_hd__xor2_2 cells:        8
ABC RESULTS:   sky130_fd_sc_hd__a21o_2 cells:        3
ABC RESULTS:   sky130_fd_sc_hd__and2_2 cells:       10
ABC RESULTS:   sky130_fd_sc_hd__buf_1 cells:        1
ABC RESULTS:   sky130_fd_sc_hd__nor2_2 cells:       11
ABC RESULTS:   sky130_fd_sc_hd__o31a_2 cells:        3
ABC RESULTS:   sky130_fd_sc_hd__o31ai_2 cells:        2
ABC RESULTS:        internal signals:      142
ABC RESULTS:           input signals:       33
ABC RESULTS:          output signals:       17
Removing temp directory.

57. Executing SETUNDEF pass (replace undef values with defined constants).

58. Executing HILOMAP pass (mapping to constant drivers).

59. Executing SPLITNETS pass (splitting up multi-bit signals).

60. Executing OPT_CLEAN pass (remove unused cells and wires).
Finding unused cells or wires in module \bka..
Removed 0 unused cells and 192 unused wires.
<suppressed ~1 debug messages>

61. Executing INSBUF pass (insert buffer cells for connected wires).

62. Executing CHECK pass (checking for obvious problems).
Checking module bka...
Found and reported 0 problems.

63. Printing statistics.

=== bka ===

   Number of wires:                143
   Number of wire bits:            188
   Number of public wires:          56
   Number of public wire bits:     101
   Number of memories:               0
   Number of memory bits:            0
   Number of processes:              0
   Number of cells:                154
     sky130_fd_sc_hd__a21bo_2        2
     sky130_fd_sc_hd__a21o_2         3
     sky130_fd_sc_hd__a21oi_2        4
     sky130_fd_sc_hd__a22o_2         4
     sky130_fd_sc_hd__a31o_2         2
     sky130_fd_sc_hd__and2_2        10
     sky130_fd_sc_hd__and2b_2        1
     sky130_fd_sc_hd__and3_2         1
     sky130_fd_sc_hd__and4_2         2
     sky130_fd_sc_hd__buf_1          1
     sky130_fd_sc_hd__dfxtp_2       50
     sky130_fd_sc_hd__inv_2          1
     sky130_fd_sc_hd__nand2_2       16
     sky130_fd_sc_hd__nand3_2        1
     sky130_fd_sc_hd__nor2_2        11
     sky130_fd_sc_hd__o21a_2         3
     sky130_fd_sc_hd__o21ai_2        2
     sky130_fd_sc_hd__o21bai_2       2
     sky130_fd_sc_hd__o22ai_2        1
     sky130_fd_sc_hd__o31a_2         3
     sky130_fd_sc_hd__o31ai_2        2
     sky130_fd_sc_hd__o41ai_2        1
     sky130_fd_sc_hd__or2_2         13
     sky130_fd_sc_hd__xnor2_2       10
     sky130_fd_sc_hd__xor2_2         8

   Chip area for module '\bka': 2024.441600

64. Executing Verilog backend.
Dumping module `\bka'.

65. Executing JSON backend.

End of script. Logfile hash: 5a8692779a, CPU: user 0.29s system 0.02s, MEM: 42.00 MB peak
Yosys 0.38 (git sha1 543faed9c8c, clang++ 17.0.6 -fPIC -Os)
Time spent: 34% 2x abc (0 sec), 19% 2x read_liberty (0 sec), ...
